{"profile_id":"production-scope-milestone-risk-plan","version":1,"artifact_types":["design-document"],"audiences":["production","leadership","discipline-leads"],"required_sections":[{"id":"delivery-scope","title":"Outcomes, scope, capacity, and assumptions"},{"id":"delivery-plan","title":"Milestones, dependencies, risks, and decisions"}],"required_tables":[{"id":"milestone-risk-table","section_id":"delivery-plan","columns":["Milestone","Exit evidence","Owner","Dependency","Risk","Mitigation"]}],"required_diagrams":[{"id":"skillstead-production-roadmap-dependency-diagram","section_id":"delivery-plan","purpose":"Show milestone sequence, critical dependencies, and decision gates","alt_text":"Production roadmap connecting milestones, dependencies, risks, decision gates, and release evidence"}],"required_images":[{"id":"scope-reference-image","section_id":"delivery-scope","purpose":"Anchor the agreed product slice","alt_text":"Approved product slice image identifying included experience and explicitly excluded adjacent scope"}],"recommended_images":[],"length_guidance":{"min_words":1200,"max_words":4200,"min_pages":5,"max_pages":18},"ppt_story_contract":{},"acceptance_criteria":["Scope, non-scope, capacity assumptions, dependencies, milestone exit evidence, owners, risks, and contingency are explicit.","No date or confidence claim appears without its basis, freshness date, uncertainty, and decision owner."],"export_rules":{"required_formats":["md","pdf","docx"],"forbidden_formats":["pptx"]},"quality_checks":["scope-integrity","dependency-feasibility","risk-ownership"]}
