{"profile_id":"data-table-contract","version":1,"artifact_types":["design-document"],"audiences":["design","engineering","qa","analytics"],"required_sections":[{"id":"data-model","title":"Schema, ownership, and lifecycle"},{"id":"validation-migration","title":"Validation, compatibility, and migration"}],"required_tables":[{"id":"field-contract-table","section_id":"data-model","columns":["Field","Type","Unit","Default","Constraints","Owner","Version"]}],"required_diagrams":[{"id":"skillstead-data-dependency-diagram","section_id":"data-model","purpose":"Map producers, consumers, and derived data","alt_text":"Dependency graph from authoritative data fields to runtime and analytics consumers"}],"required_images":[{"id":"data-inspection-image","section_id":"validation-migration","purpose":"Show a readable validation or authoring view","alt_text":"Data inspection view with validation status and invalid values clearly identified"}],"recommended_images":[],"length_guidance":{"min_words":700,"max_words":2200,"min_pages":3,"max_pages":10},"ppt_story_contract":{},"acceptance_criteria":["Every field defines type, unit, constraints, default semantics, ownership, version, and consumer impact.","Validation, backward compatibility, migration, rollback, localization, and telemetry handling are explicit."],"export_rules":{"required_formats":["md","pdf","docx"],"forbidden_formats":["pptx"]},"quality_checks":["schema-completeness","consumer-traceability","migration-safety"]}
