{"profile_id":"transition-readiness","version":1,"artifact_types":["review-report"],"audiences":["candidate","mentor","career-coach"],"required_sections":[{"id":"transition-target","title":"Target transition, constraints, and market evidence"},{"id":"readiness-case","title":"Transferable proof, gaps, risks, and decision gates"}],"required_tables":[{"id":"transition-evidence-table","section_id":"readiness-case","columns":["Target requirement","Transferable evidence","Freshness","Gap","Risk","Validation"]}],"required_diagrams":[{"id":"skillstead-transition-roadmap-dependency-diagram","section_id":"readiness-case","purpose":"Map prerequisites and alternative transition routes","alt_text":"Transition roadmap linking current proof, prerequisite gaps, validation gates, and alternative role routes"}],"required_images":[{"id":"transition-proof-image","section_id":"readiness-case","purpose":"Show transferable work evidence","alt_text":"Redacted artifact demonstrating a transferable design competency with contribution boundaries"}],"recommended_images":[],"length_guidance":{"min_words":900,"max_words":3000,"min_pages":4,"max_pages":13},"ppt_story_contract":{},"acceptance_criteria":["Readiness conclusions distinguish current fact, market evidence, inference, missing proof, and evidence freshness.","The decision includes risks, financial or time constraints, reversible validation steps, alternatives, and a no-transition condition."],"export_rules":{"required_formats":["md","pdf"],"forbidden_formats":["pptx"]},"quality_checks":["readiness-calibration","market-freshness","decision-risk"]}
