{"profile_id":"system-feature-specification","version":1,"artifact_types":["design-document"],"audiences":["design","engineering","qa"],"required_sections":[{"id":"behavior-contract","title":"Goals, actors, rules, and behavior"},{"id":"implementation-interface","title":"States, data, dependencies, telemetry, and exceptions"}],"required_tables":[{"id":"feature-rule-table","section_id":"behavior-contract","columns":["Rule","Precondition","Outcome","Exception","Test"]}],"required_diagrams":[{"id":"skillstead-feature-state-diagram","section_id":"implementation-interface","purpose":"Define feature states and legal transitions","alt_text":"State diagram with entry conditions, transitions, failure paths, and terminal states"}],"required_images":[{"id":"feature-readability-image","section_id":"behavior-contract","purpose":"Demonstrate player-facing signals","alt_text":"Feature interaction showing input, system response, and readable feedback"}],"recommended_images":[],"length_guidance":{"min_words":1200,"max_words":4000,"min_pages":5,"max_pages":15},"ppt_story_contract":{},"acceptance_criteria":["Rules, state transitions, data ownership, failure behavior, telemetry, and QA observability are testable.","Dependencies and exceptions name owners and do not conflict with responsible-design gates."],"export_rules":{"required_formats":["md","pdf","docx"],"forbidden_formats":["pptx"]},"quality_checks":["state-completeness","exception-coverage","qa-observability"]}
