{"profile_id":"character-skill-combat-monster-specification","version":1,"artifact_types":["design-document"],"audiences":["combat-design","engineering","animation","vfx","qa","accessibility"],"required_sections":[{"id":"combat-role","title":"Character and encounter role"},{"id":"combat-contract","title":"Skills, timings, states, counters, and tuning"}],"required_tables":[{"id":"combat-ability-table","section_id":"combat-contract","columns":["Ability","State","Timing","Range","Telegraph","Counterplay","Data"]}],"required_diagrams":[{"id":"skillstead-combat-state-diagram","section_id":"combat-contract","purpose":"Define combat state and ability transitions","alt_text":"Combat state graph covering anticipation, activation, recovery, interruption, and defeat"}],"required_images":[{"id":"combat-telegraph-image","section_id":"combat-contract","purpose":"Prove gameplay readability at play distance","alt_text":"Top-down combat view showing threat silhouette, telegraph, safe response, and non-color cue"}],"recommended_images":[],"length_guidance":{"min_words":1600,"max_words":5500,"min_pages":7,"max_pages":22},"ppt_story_contract":{},"acceptance_criteria":["Each ability specifies timing, range, targeting, resource cost, states, interruption, AI use, counterplay, and tuning data.","Required visual and audio telegraphs remain readable without color alone and have QA acceptance evidence."],"export_rules":{"required_formats":["md","pdf","docx"],"forbidden_formats":["pptx"]},"quality_checks":["combat-state-coverage","telegraph-readability","counterplay-validation"]}
