{"profile_id":"vision-one-pager","version":1,"artifact_types":["design-document"],"audiences":["leadership","production-team"],"required_sections":[{"id":"vision","title":"Player promise and product vision"},{"id":"boundaries","title":"Scope, assumptions, and decisions"}],"required_tables":[{"id":"vision-pillars-table","section_id":"vision","columns":["Pillar","Player outcome","Evidence"]}],"required_diagrams":[{"id":"skillstead-vision-dependency-diagram","section_id":"boundaries","purpose":"Show dependencies between promise, pillars, and constraints","alt_text":"Directed dependency map from player promise to design pillars and delivery constraints"}],"required_images":[{"id":"vision-reference-image","section_id":"vision","purpose":"Establish an original visual direction without third-party identity","alt_text":"Approved project-owned visual reference supporting the player promise"}],"recommended_images":[],"length_guidance":{"min_words":350,"max_words":800,"min_pages":1,"max_pages":2},"ppt_story_contract":{},"acceptance_criteria":["The player promise, differentiators, non-goals, assumptions, and approval decision are explicit.","Each pillar names an observable player outcome and supporting evidence or validation need."],"export_rules":{"required_formats":["md","pdf"],"forbidden_formats":["pptx"]},"quality_checks":["vision-coherence","evidence-separation","scope-boundary"]}
