{"profile_id":"design-review-decision-log","version":1,"artifact_types":["review-report"],"audiences":["design","engineering","production","qa"],"required_sections":[{"id":"review-context","title":"Review scope, evidence, and participants"},{"id":"decision-record","title":"Findings, decisions, owners, and follow-up"}],"required_tables":[{"id":"decision-log-table","section_id":"decision-record","columns":["Issue","Evidence","Options","Decision","Owner","Due","Status"]}],"required_diagrams":[{"id":"skillstead-decision-dependency-diagram","section_id":"decision-record","purpose":"Show dependencies and downstream impact of decisions","alt_text":"Decision dependency graph linking reviewed issues, selected actions, owners, and affected systems"}],"required_images":[{"id":"review-annotation-image","section_id":"review-context","purpose":"Preserve approved visual review evidence","alt_text":"Annotated review image identifying the exact interface or gameplay issue under discussion"}],"recommended_images":[],"length_guidance":{"min_words":500,"max_words":2200,"min_pages":2,"max_pages":10},"ppt_story_contract":{},"acceptance_criteria":["Each finding cites evidence and distinguishes recommendation, accepted decision, rejected option, and unresolved question.","Every accepted action records owner, due condition, dependency impact, verification method, and status."],"export_rules":{"required_formats":["md","pdf"],"forbidden_formats":["pptx"]},"quality_checks":["decision-traceability","action-ownership","evidence-linkage"]}
