{"profile_id":"economy-balance-specification","version":1,"artifact_types":["design-document"],"audiences":["economy-design","analytics","production","qa","responsible-design"],"required_sections":[{"id":"economy-goals","title":"Player value, constraints, and fairness goals"},{"id":"economy-model","title":"Sources, sinks, progression, tuning, and monitoring"}],"required_tables":[{"id":"economy-balance-table","section_id":"economy-model","columns":["Resource","Source","Sink","Rate","Cap","Segment","Metric"]}],"required_diagrams":[{"id":"skillstead-economy-source-sink-diagram","section_id":"economy-model","purpose":"Map resource circulation and control points","alt_text":"Economy flow from sources through inventories and exchanges to sinks, caps, and monitoring"}],"required_images":[{"id":"economy-player-view-image","section_id":"economy-goals","purpose":"Show how value and cost are communicated","alt_text":"Player-facing economy view with balances, costs, outcomes, and purchase consequences visible"}],"recommended_images":[],"length_guidance":{"min_words":1500,"max_words":5000,"min_pages":6,"max_pages":20},"ppt_story_contract":{},"acceptance_criteria":["Sources, sinks, rates, caps, cohorts, assumptions, simulation inputs, and monitoring thresholds reconcile.","Monetization and progression avoid deceptive pressure, protect minors and vulnerable players, and define rollback triggers."],"export_rules":{"required_formats":["md","pdf","docx"],"forbidden_formats":["pptx"]},"quality_checks":["economy-conservation","fairness-gate","rollback-readiness"]}
