{"profile_id":"competency-matrix","version":1,"artifact_types":["career-document"],"audiences":["learner","mentor","hiring-manager"],"required_sections":[{"id":"competency-model","title":"Role-specific competencies and level definitions"},{"id":"evidence-assessment","title":"Evidence, confidence, gaps, and actions"}],"required_tables":[{"id":"competency-evidence-table","section_id":"evidence-assessment","columns":["Competency","Target level","Evidence","Freshness","Confidence","Gap","Action"]}],"required_diagrams":[{"id":"skillstead-competency-dependency-diagram","section_id":"competency-model","purpose":"Show prerequisite and reinforcing competencies","alt_text":"Competency dependency map distinguishing prerequisites, parallel skills, and role-specific outcomes"}],"required_images":[{"id":"competency-proof-image","section_id":"evidence-assessment","purpose":"Demonstrate the expected proof format","alt_text":"Redacted portfolio artifact with competency evidence and contribution annotations"}],"recommended_images":[],"length_guidance":{"min_words":900,"max_words":2800,"min_pages":4,"max_pages":12},"ppt_story_contract":{},"acceptance_criteria":["Every rating is tied to dated observable evidence and separates self-assessment from reviewer-confirmed fact.","Target levels are role-contextual, gaps have prioritized practice, and missing evidence is not scored as ability."],"export_rules":{"required_formats":["md","pdf"],"forbidden_formats":["pptx"]},"quality_checks":["rating-evidence-binding","level-consistency","gap-priority"]}
