{"profile_id":"game-design-brief","version":1,"artifact_types":["design-document"],"audiences":["design","engineering","production"],"required_sections":[{"id":"scope","title":"Goal, audience, scope, and non-scope"},{"id":"design","title":"Player experience and design approach"},{"id":"validation","title":"Dependencies, risks, and acceptance"}],"required_tables":[{"id":"design-requirements-table","section_id":"design","columns":["Requirement","Rationale","Owner","Acceptance"]}],"required_diagrams":[{"id":"skillstead-design-flow-diagram","section_id":"design","purpose":"Trace the intended player flow and key decisions","alt_text":"Player flow from entry through choice, feedback, and completion"}],"required_images":[{"id":"design-context-image","section_id":"design","purpose":"Clarify the intended interaction context","alt_text":"Original design context image with the primary interaction emphasized"}],"recommended_images":[],"length_guidance":{"min_words":700,"max_words":1800,"min_pages":2,"max_pages":6},"ppt_story_contract":{},"acceptance_criteria":["Goals, non-goals, assumptions, dependencies, unresolved questions, owners, and reviewers are identifiable.","Every design requirement has a testable acceptance condition and no unsupported fact is presented as settled."],"export_rules":{"required_formats":["md","pdf"],"forbidden_formats":["pptx"]},"quality_checks":["section-completeness","requirement-testability","evidence-separation"]}
