{"profile_id":"reference-comparison","version":1,"artifact_types":["review-report"],"audiences":["design","research","production"],"required_sections":[{"id":"comparison-scope","title":"Reference comparison scope and evidence limits"},{"id":"cross-game-findings","title":"Cross-game system comparison and verification queue"}],"required_tables":[{"id":"comparison-matrix","section_id":"cross-game-findings","columns":["System","Reference","Evidence","Claim kind","Coverage","State"]}],"required_diagrams":[{"id":"comparison-coverage-map","section_id":"cross-game-findings","purpose":"Show compared systems and their evidence coverage states","alt_text":"Comparison map linking each source game system to ready or hold evidence coverage"}],"required_images":[{"id":"comparison-evidence-image","section_id":"comparison-scope","purpose":"Show a bounded visual reference for a compared system","alt_text":"Annotated reference image showing the compared game system in its recorded context"}],"recommended_images":[],"length_guidance":{"min_words":700,"max_words":2800,"min_pages":3,"max_pages":10},"ppt_story_contract":{},"acceptance_criteria":["Each comparison binds to its source system, evidence, reference context, and claim kind.","Insufficient or unknown coverage remains hold and appears in the verification queue."],"export_rules":{"required_formats":["md","pdf"],"forbidden_formats":["pptx"]},"quality_checks":["comparison-traceability","coverage-state-parity","verification-queue-completeness"]}
