{"profile_id":"reference-system-analysis","version":1,"artifact_types":["design-document"],"audiences":["design","research","production"],"required_sections":[{"id":"reference-scope","title":"Reference scope, evidence, and limitations"},{"id":"system-atlas","title":"System inventory, maps, loops, priorities, and deep dives"}],"required_tables":[{"id":"reference-system-inventory","section_id":"system-atlas","columns":["System","Evidence","Claim kind","Coverage","Unknowns"]}],"required_diagrams":[{"id":"reference-system-map","section_id":"system-atlas","purpose":"Show system inputs, processes, outputs, and declared loops","alt_text":"System map showing evidence-bound inputs, processes, outputs, and loops"}],"required_images":[{"id":"reference-evidence-image","section_id":"reference-scope","purpose":"Locate observed evidence in its recorded reference context","alt_text":"Annotated reference image identifying the observed game state, platform, and version context"}],"recommended_images":[],"length_guidance":{"min_words":900,"max_words":3500,"min_pages":4,"max_pages":12},"ppt_story_contract":{},"acceptance_criteria":["Reference scope, versions, platforms, evidence limitations, and verification questions are visible.","System inventory precedes evaluation and every material claim traces to available evidence or an explicit unknown."],"export_rules":{"required_formats":["md","pdf","docx"],"forbidden_formats":["pptx"]},"quality_checks":["evidence-traceability","system-map-completeness","unknowns-visible"]}
