{"profile_id":"portfolio-case-study","version":1,"artifact_types":["career-document"],"audiences":["recruiter","hiring-manager","peer-reviewer"],"required_sections":[{"id":"case-context","title":"Problem, constraints, role, and ownership"},{"id":"case-evidence","title":"Process, decisions, iterations, outcomes, and reflection"}],"required_tables":[{"id":"case-decision-evidence-table","section_id":"case-evidence","columns":["Decision","Evidence","My contribution","Alternative","Outcome","Learning"]}],"required_diagrams":[{"id":"skillstead-case-study-process-diagram","section_id":"case-evidence","purpose":"Show evidence-bearing iterations and decisions","alt_text":"Case-study process from problem framing through decisions, prototypes, feedback, iteration, and measured outcome"}],"required_images":[{"id":"case-study-proof-image","section_id":"case-evidence","purpose":"Show a representative authored artifact and its impact","alt_text":"Redacted portfolio artifact annotated with candidate contribution, decision context, and outcome evidence"}],"recommended_images":[],"length_guidance":{"min_words":1200,"max_words":3800,"min_pages":5,"max_pages":15},"ppt_story_contract":{},"acceptance_criteria":["Team context, personal contribution, asset provenance, constraints, decisions, iterations, and outcomes are specific and verifiable.","Claims distinguish measured result, stakeholder feedback, candidate interpretation, and hindsight without inflating ownership."],"export_rules":{"required_formats":["md","pdf"],"forbidden_formats":["pptx"]},"quality_checks":["contribution-clarity","proof-traceability","claim-calibration"]}
