{"profile_id":"portfolio-review-backlog","version":1,"artifact_types":["review-report"],"audiences":["candidate","mentor","peer-reviewer"],"required_sections":[{"id":"review-baseline","title":"Target role, review date, artifacts, and rubric"},{"id":"improvement-backlog","title":"Findings, priorities, actions, and verification"}],"required_tables":[{"id":"portfolio-backlog-table","section_id":"improvement-backlog","columns":["Finding","Evidence","Impact","Priority","Action","Owner","Verification"]}],"required_diagrams":[{"id":"skillstead-portfolio-dependency-diagram","section_id":"improvement-backlog","purpose":"Order improvements by dependency and hiring impact","alt_text":"Improvement dependency map connecting blocking gaps, supporting edits, review gates, and readiness outcomes"}],"required_images":[{"id":"portfolio-review-image","section_id":"review-baseline","purpose":"Anchor feedback to the reviewed artifact state","alt_text":"Dated redacted portfolio page annotated with the exact review finding"}],"recommended_images":[],"length_guidance":{"min_words":600,"max_words":2200,"min_pages":3,"max_pages":10},"ppt_story_contract":{},"acceptance_criteria":["Every finding cites the dated artifact state, rubric dimension, evidence, impact, and reviewer confidence.","Backlog priority reflects dependencies and target-role value, with owners and observable verification conditions."],"export_rules":{"required_formats":["md","pdf"],"forbidden_formats":["pptx"]},"quality_checks":["review-baseline-freshness","priority-rationale","verification-clarity"]}
