{"profile_id":"playtest-metrics-report","version":1,"artifact_types":["review-report"],"audiences":["design","research","analytics","production"],"required_sections":[{"id":"study-context","title":"Question, sample, method, and limitations"},{"id":"findings-decisions","title":"Evidence, interpretation, decisions, and follow-up"}],"required_tables":[{"id":"playtest-finding-table","section_id":"findings-decisions","columns":["Finding","Evidence","Confidence","Segment","Impact","Decision"]}],"required_diagrams":[{"id":"skillstead-playtest-flow-diagram","section_id":"study-context","purpose":"Map test tasks and observation points","alt_text":"Playtest flow showing tasks, observation checkpoints, branches, and completion outcomes"}],"required_images":[{"id":"playtest-evidence-image","section_id":"findings-decisions","purpose":"Illustrate an anonymized observed usability issue","alt_text":"Anonymized interaction frame with the observed issue and relevant interface state highlighted"}],"recommended_images":[],"length_guidance":{"min_words":1000,"max_words":3500,"min_pages":4,"max_pages":15},"ppt_story_contract":{},"acceptance_criteria":["Sample, protocol, date, exclusions, limitations, quantitative results, qualitative observations, and confidence are reported.","Facts, participant statements, analyst inference, rejected explanations, decisions, and follow-up tests remain distinct."],"export_rules":{"required_formats":["md","pdf"],"forbidden_formats":["pptx"]},"quality_checks":["method-transparency","fact-inference-separation","privacy-redaction"]}
