{"profile_id":"job-posting-evidence","version":1,"artifact_types":["review-report"],"audiences":["job-seeker","career-coach"],"required_sections":[{"id":"source-scope","title":"Posting sources, capture dates, and limitations"},{"id":"requirement-evidence","title":"Requirement patterns, confidence, and portfolio implications"}],"required_tables":[{"id":"job-requirement-evidence-table","section_id":"requirement-evidence","columns":["Requirement","Source","Captured","Frequency","Interpretation","Portfolio proof"]}],"required_diagrams":[{"id":"skillstead-job-evidence-dependency-diagram","section_id":"requirement-evidence","purpose":"Connect observed requirements to capabilities and proof","alt_text":"Evidence map from dated job-posting requirements through inferred competencies to portfolio proof needs"}],"required_images":[{"id":"posting-evidence-image","section_id":"source-scope","purpose":"Preserve a redacted source capture for audit","alt_text":"Redacted dated job-posting excerpt with role, requirement, and source boundary identified"}],"recommended_images":[],"length_guidance":{"min_words":900,"max_words":3000,"min_pages":4,"max_pages":14},"ppt_story_contract":{},"acceptance_criteria":["Each observed requirement retains source, capture date, market scope, and a note about possible staleness or sampling bias.","Quoted facts, cross-posting patterns, interpretation, and recommended portfolio proof are visibly distinct."],"export_rules":{"required_formats":["md","pdf"],"forbidden_formats":["pptx"]},"quality_checks":["source-traceability","freshness-labeling","inference-boundary"]}
