{"profile_id":"core-motivation-loop","version":1,"artifact_types":["design-document"],"audiences":["design","production","research"],"required_sections":[{"id":"player-motivation","title":"Player motivation and desired experience"},{"id":"loop-model","title":"Actions, feedback, rewards, and return triggers"}],"required_tables":[{"id":"loop-validation-table","section_id":"loop-model","columns":["Loop step","Player decision","Feedback","Metric","Risk"]}],"required_diagrams":[{"id":"skillstead-core-motivation-loop-diagram","section_id":"loop-model","purpose":"Show the playable loop and motivation feedback","alt_text":"Circular flow from player goal through action, feedback, reward, progression, and renewed intent"}],"required_images":[{"id":"loop-moment-image","section_id":"player-motivation","purpose":"Illustrate the high-value player moment","alt_text":"Original gameplay concept showing the primary motivated action and feedback"}],"recommended_images":[],"length_guidance":{"min_words":700,"max_words":1800,"min_pages":3,"max_pages":7},"ppt_story_contract":{},"acceptance_criteria":["Every loop edge states the player action, system response, feedback channel, and reason to continue or stop.","Motivation hypotheses are separated from observed evidence and include a playtest plan."],"export_rules":{"required_formats":["md","pdf"],"forbidden_formats":["pptx"]},"quality_checks":["loop-closure","motivation-evidence","feedback-readability"]}
