{"profile_id":"reverse-design-document","version":1,"artifact_types":["career-document"],"audiences":["portfolio-reviewer","designer","mentor"],"required_sections":[{"id":"observed-behavior","title":"Observed player-facing behavior and evidence"},{"id":"inferred-design","title":"Inferred rules, intent, alternatives, and tests"}],"required_tables":[{"id":"observation-inference-table","section_id":"inferred-design","columns":["Observation","Evidence","Inference","Confidence","Alternative","Test"]}],"required_diagrams":[{"id":"skillstead-reverse-system-loop-diagram","section_id":"inferred-design","purpose":"Model the inferred system while preserving uncertainty","alt_text":"Inferred system loop with observed nodes distinguished from hypothetical rules and uncertain links"}],"required_images":[{"id":"reverse-design-evidence-image","section_id":"observed-behavior","purpose":"Anchor analysis in lawful, cited observation","alt_text":"Cited gameplay observation frame with relevant behavior annotated and unrelated identity minimized"}],"recommended_images":[],"length_guidance":{"min_words":1400,"max_words":4500,"min_pages":6,"max_pages":18},"ppt_story_contract":{},"acceptance_criteria":["Direct observation, sourced fact, inference, confidence, alternative explanation, and unknown implementation detail are separate.","The analysis demonstrates design reasoning without claiming confidential access or copying proprietary documentation."],"export_rules":{"required_formats":["md","pdf","docx"],"forbidden_formats":["pptx"]},"quality_checks":["observation-inference-separation","alternative-hypothesis","rights-boundary"]}
