{"profile_id":"ui-ux-flow-state-specification","version":1,"artifact_types":["design-document"],"audiences":["ux","ui","engineering","qa","accessibility"],"required_sections":[{"id":"user-goal","title":"User goal, context, and information hierarchy"},{"id":"interaction-contract","title":"Flow, component states, input, and recovery"}],"required_tables":[{"id":"ui-state-table","section_id":"interaction-contract","columns":["Component","State","Trigger","Feedback","Input","Accessibility","Recovery"]}],"required_diagrams":[{"id":"skillstead-ui-flow-state-diagram","section_id":"interaction-contract","purpose":"Map screens, decisions, states, and error recovery","alt_text":"User flow linking screens, decisions, loading, empty, error, success, and recovery states"}],"required_images":[{"id":"ui-key-screen-image","section_id":"user-goal","purpose":"Demonstrate hierarchy and interaction focus","alt_text":"Annotated key screen with focus order, primary action, status feedback, and safe-area bounds"}],"recommended_images":[],"length_guidance":{"min_words":1200,"max_words":4200,"min_pages":5,"max_pages":18},"ppt_story_contract":{},"acceptance_criteria":["Happy, empty, loading, error, interrupted, permission, and recovery states are specified for supported inputs.","Focus order, text alternatives, scaling, contrast, safe areas, and non-pointer operation have acceptance checks."],"export_rules":{"required_formats":["md","pdf","docx"],"forbidden_formats":["pptx"]},"quality_checks":["flow-completeness","state-coverage","accessibility-check"]}
